{
  "max_threads": 8,
  "dpb_size": 6,
  "reorder_frames": true,
  "low_delay": false,
  "error_concealment": "spatial",
  "skip_nonref": true,
  "deblock": true,
  "sao": true,
  "film_grain": false,
  "jitter_buf_ms": 120,
  "sync_tolerance_ms": 80,
  "av_sync": "video_master",
  "timestamp_correction": true,
  "color_space": "BT.709",
  "range": "limited",
  "hdr_tone_map": "off",
  "hdr_eotf": "SDR",
  "scaler": "lanczos",
  "denoise": "off",
  "deband": "low",
  "sharpen": "off",
  "deinterlace_mode": "bff",
  "deinterlace_algo": "yadif",
  "frame_dup_thresh_ms": 15,
  "max_output_latency_ms": 700,
  "cap_max_res_w": 3840,
  "cap_max_res_h": 2160,
  "output_format": "NV12"
}